{
  "schema_id": "gx.toolchain.handoff",
  "schema_version": "1.0.0",
  "solution_id": "network-assistant",
  "solution_intent_ref": "dist/network-assistant.solution.json",
  "bundle_handoff": {
    "tool": "greentic-bundle",
    "bundle_output_path": "dist/dist/network-assistant.gtbundle",
    "bundle_plan_path": "dist/network-assistant.bundle-plan.json",
    "bundle_answers_path": "dist/network-assistant.bundle.answers.json",
    "setup_answers_path": "dist/network-assistant.setup.answers.json"
  },
  "launcher_handoff": {
    "tool": "greentic-dev",
    "launcher_answers_path": "dist/network-assistant.launcher.answers.json",
    "selected_action": "bundle",
    "delegated_schema_id": "greentic-bundle.wizard.answers",
    "delegated_wizard_id": "greentic-bundle.wizard.run"
  },
  "pack_handoff": {
    "tool": "greentic-pack",
    "pack_input_path": "dist/network-assistant.pack.input.json"
  },
  "provenance": {
    "producer": "gx",
    "produced_by": "greentic-x",
    "ownership_boundary": "composition_only"
  },
  "locks": {
    "catalog_resolution_policy": "update_then_pin",
    "provider_selection": "webchat",
    "template_mode": "basic_empty"
  }
}
